Date,News,Subjectivity,Polarity,compound,neg,pos,neu,Open,High,Low,Close,Adj Close,Volume
2024-02-27,"Poland warns US House speaker Mike Johnson: youre to blame if Russia advances in Ukraine North Korea sent more than 3m artillery shells to Russia, says Seoul VSquare: Kremlin leaks, secret files reveal how Putin pre-rigged his reelection Microplastics found in every human placenta tested in study Russia bans gasoline exports for 6 months from March 1 Zelensky: Losing to Putin is ‘the same’ as death Two candidates for mayor of a Mexican city are shot dead within hours of each other Malcolm Turnbull says Donald Trumps creepy embrace of Vladimir Putin a threat to Australian security - ABC News Israel plans to transfer warning systems for missile attacks to Ukraine - UN envoy Yellen urges world leaders to unlock frozen Russian Central Bank assets and send them to Ukraine Spain’s plan to ban domestic flights where you can take a train in under two and half hours Biden says Gaza ceasefire could come by end of the weekend, would allow release of hostages No Nato soldiers on Ukrainian soil, says Germanys Scholz in rebuke to Frances Macron Police banned from Sydney Mardi Gras after gay couple murder case Macron says Russian defeat in Ukraine vital for security in Europe Amazon lobbyists banned from EU Parliament Sri Lanka cancels visas for thousands of Russian fugitives Western troops on the ground in Ukraine is not ruled out in the future, French leader says European Parliament approves 50 billion euro package for Ukraine France bans steak label on vegetarian products Macron announces coalition to send Kyiv long-range missiles Navalny ally urges Russians to join election day protest in his memory, drawing Kremlin ire /r/WorldNews Live Thread: Russian Invasion of Ukraine Day 734, Part 1 (Thread #880) New Zealand set to scrap world-first tobacco ban Biden warns Israel of diminishing international support over Gaza offensive in interview with Seth Meyers | CNN Politics 2 million animals dead as extreme winter weather hits Mongolia Dutch to give 100 million euros to Czech initiative to buy ammunition for Ukraine Israel is ready to pause its war in Gaza during Ramadan if a hostage deal is reached, Biden says EU introduces 10 year prison sentences for environmental crimes The Doomsday Glacier is rapidly melting. Scientists now have evidence for when it started and why Conservationists raised the alarm on Tuesday as South Africa reported a sharp increase in rhino poaching, with almost 500 animals killed last year Poland calls for transfer of frozen Russian assets to Ukraine Russian Red Cross has pro-Kremlin bias, conducts military fundraising and abuse Ukrainian POWs Hungarys most important national security concern is not to share a border with Russia – Orbán at V4 summit Mexico City may be just months away from running of out water | CNN Houthis knock out underwater cables linking Europe to Asia - report Iran makes surprise cut to stockpile of near-bomb-grade uranium EU nature law passes to restore 20% of Europes degraded land and sea Swiss exports to Russia suspected of evading sanctions  Already serving a life sentence for his attack on a German synagogue in 2019, the 32-year-old has been handed a further seven years after taking two prison staff hostage and threatening them with a self-made firearm Nato allies reject Emmanuel Macron idea of troops to Ukraine",0.264905303030303,0.00619318181818182,-0.9966,0.163,0.066,0.771,39087.9,39087.9,38881.9,38972.41,38972.41,272860000.0
2024-02-26,"It’s official: Sweden to join NATO Frances Macron says sending troops to Ukraine cannot be ruled out Russia’s 2024 election interference has already begun: Moscow is spreading disinformation about Joe Biden and other Democrats to lessen U.S. military aid to Ukraine and U.S. support for NATO, former U.S. officials and cyber experts say Sell homes of Putin cronies, says London mayor Houthis knock out underwater cables linking Europe to Asia - report Palestinian Prime Minister Submits Resignation to President Abbas Denmark drops investigation into Nord Stream pipeline blasts Russian jamming is now messing up GPS signals for Norwegian aviation practically every day Sweden joins Nato: Leaders hail membership as win for West against Russia IDF says probe indicates no troops were in area where 6-year-old Gazan girl was killed Fears of famine grow in Gaza as aid agencies suspend deliveries Navalny was close to being freed in a prisoner swap, says ally Ukrainian troops pull back again as Russias onslaught pushes ahead in eastern Ukraine NYT: CIA network of bases in Ukraine at risk if US does not pass aid UK Home Office accused of cover-up over ‘golden visas’ for super-rich Russians Putin’s Allies Accused of Plotting Another Russian Land-Grab Polish Foreign Minister warns US of profound consequences if aid to Ukraine is not approved. ""Some countries will start hedging their bets, and others will consider developing their own nuclear weapons programs,"" Moscow ally Serbia cracks down on anti-war Russians living in the Balkan country /r/WorldNews Live Thread: Russian Invasion of Ukraine Day 733, Part 1 (Thread #879) Several Indians discharged from Russian army following Indias demand: MEA IDF says it uncovered major Gaza tunnel passing under hospital, university Ukraines Zelenskiy urges fight for Crimea after 10 years of occupation EU sanctions on Russia ‘massively circumvented’ via third countries, study finds Hello Kitty theme park in Tokyo closed after ‘terrorist threat’ ADHD linked to evolutionary success in ancient humans HUR Chief Budanov Says Seems Navalny Died of Detached Blood Clot Rights campaigner calls Russia fascist in court Military intelligence: Russia plans to produce 2.7 million shells this year. We had better get ahead of them. Germany, India holding secret talks on purchase of shells for Ukrainian Armed Forces Bloomberg: Russia buys tens of millions in banned technologies from EU Half of Western military aid not delivered on time, says Ukraine minister G7 promises to increase sanctions and block Russian assets until end of war in Ukraine",0.2437275985663082,0.03903144346692732,-0.9733,0.121,0.063,0.816,39144.79,39245.89,39025.8,39069.23,39069.23,296930000.0
2024-02-23,"‘China destroyed 21,000 acres of West Philippine Sea coral reefs’ Zelenskyy: Trump cannot end Ukrainian war in 24 hours Kremlin threatens to let Navalny’s body rot unless he is buried in secret, says family US targets Russia with more than 500 new sanctions Putin Fears Navalny Funeral Could Trigger Mass Demonstrations, Khodorkovsky Says US says Israels new settlements in West Bank are inconsistent with international law Germany legalises cannabis, but makes it hard to buy In Russia, the number of individuals convicted on political grounds during President Vladimir Putin’s most recent term has surpassed that of the USSR under Nikita Khrushchev and Leonid Brezhnev, reports the Russian publication Proekt (Project) Over 70% of Trainee Doctors Submit Resignations in South Korea Amid Protests ISS: Russian special services behind attack on Estonian ministers car Putin says nearly all of Russias nuclear forces have been modernised Philippines arming up for D-Day with China UK firms make four-day workweek permanent after world’s biggest trial It’s been two years since Russias full-scale invasion of Ukraine. I lead The Wall Street Journal’s Ukraine coverage. AMA. Zelensky: All Ukrainians waiting for first F-16 fighters to arrive Hungarian foreign minister visiting Iran for trade negotiations ""forgot"" that Tehran supplies Russia with weapons G20 says two-state solution only answer to Israel-Palestinian conflict Hungary buys Swedish fighter jets, prepares to approve NATO bid /r/WorldNews Live Thread: Russian Invasion of Ukraine Day 730, Part 1 (Thread #876) South Korea doctors’ strike: ‘severe’ public health alert issued for first time Israeli researchers find breakthrough in lab-made sperm for infertile couples Smartphones to be banned in Italian classrooms Israel Joins Cease-Fire Talks in Paris Armenia suspends participation in Russian-led Collective Security Treaty Organisation Indian Foreign Ministry urges citizens to avoid joining Russian army in Ukraine conflict Guards at prison where Navalny died allegedly tortured inmate to death in 2022 France blames Russia’s FSB for anti-Semitic Star of David graffiti campaign Zelenskyy on corruption in Ukraine: Everything is clean Bolsonaro Coup Plans: U.S. Pressure Campaign Kept Brazils Generals at Bay US working to provide Ukraine with longer-range ATACMS missiles - White House High-rise complex consumed by fire in Spain was made in 2008 with ‘innovative materials’ by a developer that went bankrupt PM: F-16 aircraft from Denmark will appear in Ukraine by summer Ukrainian air defenses destroy 23 out of 31 kamikaze drones overnight",0.328517316017316,0.04304112554112554,-0.9947,0.166,0.051,0.782,39127.97,39282.28,39094.36,39131.53,39131.53,286910000.0
2024-02-22,"US lander successfully touches down on moon for first time in over 50 years Gunmen sent by Moscow killed defector sheltering in Alicante, Spanish intelligence services say Russia threatens to shoot aircraft patrolling Black Sea, claims France Moldovan breakway Republic Transnistria going to request annexation to Russia ABC News: Ukraine could face catastrophic arms shortage within weeks, US officials say President Biden to meet with Alexei Navalnys widow and daughter Ukraine will have right to use F-16s to attack military targets in Russia - Stoltenberg Putin still believes he can win in Ukraine, says western assessment | Russia Canada summons Russian ambassador in protest of Alexei Navalnys death Latvia to become first EU country to ban imports of grain from Russia, Belarus Russia pulls out of fishing deal and tells Britons to lose weight Alexei Navalny’s mother accuses Russian authorities of blackmailing her over son’s funeral Initial report from paramedics of suspected terror shooting near Jerusalem, 6 wounded US promises new sanctions on Iran for its support of Russias war in Ukraine, potential missile sale Russian priests sign open letter calling for Navalny’s body to be released to family Denmark Signs 10-year Security Agreement With Ukraine Stoltenberg: Ukraine’s right to self-defense includes F-16 strikes on legitimate Russian military targets outside Ukraine U.S. Navy petty officer based in Japan charged with espionage /r/WorldNews Live Thread: Russian Invasion of Ukraine Day 729, Part 1 (Thread #875) Polish farmers’ protests “possibly influenced by Russian agents”, says foreign ministry after pro-Putin banner Denmark announces new aid package for Ukraine and F-16 delivery UK quits treaty that lets fossil fuel firms sue governments over climate policies Russia Threatens Moldova With ‘Military Scenario’ Over Transnistria Cargo ship fractures bridge in Guangzhou, sending vehicles into the water below Romanian Parliament bans sale of energy drinks to minors Russia struggling with supply of weapons and ammunition for Ukraine war - Western officials IDF said advancing Gaza City pilot to have unaffiliated locals take over governance Ukraine’s air defenses shoot down 8 out of 10 enemy Shahed UAVs overnight Governments around the world are ""reaching beyond their borders"" to attack their own citizens abroad in order to crush dissent, Human Rights Watch said Thursday, urging more protection for them Germanys Bundestag votes against Taurus missiles to Ukraine Britain’s ‘deep state’ thwarted my plans, Liz Truss tells US hard-right summit UK aid supplies air-dropped into Gaza for first time",0.30315217815217815,0.09129031629031628,-0.9933,0.169,0.057,0.773,38845.19,39149.61,38802.07,39069.11,39069.11,324630000.0
2024-02-21,"Russia arrests US dual national over alleged $51 Ukrainian charity donation, faces up to 20 years in prison for treason The UK freezes assets of six Russian prison bosses in charge of the Arctic penal colony where opposition leader Alexei Navalny died Russians Who Paid Tribute to Navalny Are Hit With Military Summons U.S. Attorney Announces Nuclear Materials Trafficking Charges Against Japanese Yakuza Leader Ukrainian missile attack on Russian training ground kills at least 60 Alexander Smirnov: FBI source accused of Biden lies linked to Russian intelligence Israels Knesset votes 99-11 against any unilateral recognition of Palestinian state Iran sends Russia hundreds of ballistic missiles Alexei Navalny: Mother demands Putin return sons body Hamas chief Sinwars health deteriorates, suffering from severe pneumonia - report Feds charge Japanese Yakuza leader with nuclear materials trafficking Australian bishop Christopher Saunders has been charged with rape and a string of sex offences - some against children. Israel to open another Gaza border crossing for humanitarian aid - report Turkey’s fifth-generation fighter plane takes off for maiden flight Houthis Fire at Ship Carrying Humanitarian Aid to Yemen, US Says /r/WorldNews Live Thread: Russian Invasion of Ukraine Day 728, Part 1 (Thread #874) Canada set to help bankroll massive ammunition shipments to Ukraine: sources | CBC News Mexican police confirm grisly gang video showing bodies kicked, burned and shot Trident missile misfired and crashed into ocean during rare test launch Police searched alleged Chinese overseas police base in Tokyo Pro-war blogger takes own life after propagandists attack Avdiivka post Police interventions fall by half after Polish city of Kraków bans alcohol sales at night Argentinas poverty levels hit 57% of population, a 20-year high in January Poland probes pro-Putin banner at farmers protest Zelenskyy calls for urgent talks to end Polish border crisis Lithuania to close 2 more checkpoints with Russian ally Belarus as tensions along the border rise",0.31277777777777777,-0.015429292929292937,-0.9933,0.174,0.038,0.788,38483.66,38618.03,38338.58,38612.24,38612.24,279510000.0
