Date,News
2024-02-19,Germany to propose new sanctions against Russia after death of Alexei Navalny
2024-02-19,Houthis claim ‘catastrophic’ attack in Red Sea that prompted crew to abandon ship
2024-03-07,"Belgium exists largely ‘thanks to Russia,’ Putin claims"
2024-02-22,"Latvia to become first EU country to ban imports of grain from Russia, Belarus"
2024-03-05,Russia Eyes Nuclear Plant With China on the Moon in 10 Years
2024-02-13,France to impose travel bans on violent Israeli settlers
2024-02-19,Gantz: Israel will launch Rafah offensive if hostages not returned by Ramadan
2024-02-26,"Polish Foreign Minister warns US of ''profound consequences'' if aid to Ukraine is not approved. ""Some countries will start hedging their bets, and others will consider developing their own nuclear weapons programs,"""
2024-02-15,Japan unexpectedly slips into a recession
2024-02-13,"Putin to Skip Presidential Debates, Kremlin Says"
2024-03-03,Burkina Faso says 170 dead in village 'executions'
2024-02-29,‘A historic step’: G20 discuss plans for global minimum tax on billionaires
2024-02-16,Chun Ki-won: Hero pastor jailed for sexually abusing North Korea teenage escapees
2024-02-15,"Egypt clearing land, building wall near Gaza border, satellite imagery shows"
2024-02-27,Police banned from Sydney Mardi Gras after gay couple murder case
2024-03-08,Detained US-Russian ballerina Ksenia Karelina details horrific conditions at detention centre
2024-02-28,"Red Sea: the German frigate ""Hessen"" opens fire on an allied drone without managing to shoot it down"
2024-03-07,"Hamas delegation leaves Cairo, no sign of progress in ceasefire talks"
2024-03-08,India raids network sending citizens to fight for Russia
2024-02-27,Macron says Russian defeat in Ukraine vital for security in Europe
2024-02-17,"Ukraine war: 'Artificial shortage' of weapons helps Putin, says Zelensky"
2024-03-04,IDF accuses additional UNRWA officials of Oct. 7 massacre
2024-02-15,‘Dead’ Black Sea Fleet Commander Reportedly Sacked After Latest Naval Loss
2024-03-09,"Shouting ""Elections now!"" and ""Bring back the hostages now!"", thousands of Israeli demonstrators gathered in Tel Aviv Saturday to demand the departure of Prime Minister Benjamin Netanyahu after five months of war in Gaza"
2024-02-15,"Hamas rejects Israeli proposal to release 1,500 inmates for hostages"
2024-02-18,"Czech President says Czechia found way to get 800,000 shells for Ukraine"
2024-02-23,ISS: Russian special services behind attack on Estonian minister's car
2024-03-05,30 rockets launched from Lebanon toward Kiryat Shmona
2024-03-04,"IDF, local Gazans make attempt to cooperate on aid behind Hamas's back - report"
2024-03-08,France finds Baltic allies in its spat with Germany over Ukraine troop deployment
2024-02-25,Zelensky: Russia preparing offensive for early summer
2024-03-06,Greenland Women Sue Denmark Over Forced Teenage Birth Control
2024-02-18,"Iran, wary of wider war, urges its proxies to avoid provoking U.S."
2024-03-01,"‘Stupidity’ poses a bigger threat than AI, CEO of Italian defense giant Leonardo says"
2024-03-10,"""Soldiers from NATO countries are already in Ukraine"" - Polish FM"
2024-02-28,US sanctions to damage India’s oil supply from Russia
2024-02-22,Russia pulls out of fishing deal and tells Britons to 'lose weight'
2024-03-07,The planet just shattered heat records for the ninth month in a row
2024-03-04,Humans have driven Earth’s freshwater cycle out of stable state: Study
2024-02-29,European Parliament approves resolution to support Ukraine with weapons until victory
2024-02-19,Yemen's Houthis say they attacked two US ships in Gulf of Aden
2024-02-27,Amazon lobbyists banned from EU Parliament
2024-02-27,Sri Lanka cancels visas for thousands of Russian fugitives
2024-02-25,"Britons should prepare for conscription if Russia hits Nato, warns ex-Army chief"
2024-02-19,North Korea's Kim Jong Un receives car as gift from Putin - KCNA
2024-03-07,Sweden set to become NATO’s 32nd member as PM visits Washington
2024-03-04,Putin ally says 'Ukraine is Russia' and historical territory needs to 'come home'
2024-03-09,Ukraine war latest: Zelensky rules out Erdogan's idea of peace summit with Russia during Turkey visit
2024-02-28,China urges largest nuclear states to negotiate a 'no-first-use' treaty
2024-02-29,Hearse drivers refuse to take Alexei Navalny's body to morgue
2024-03-09,Gunmen kidnap 227 pupils from school in Nigeria
2024-02-11,Ukraine's missing children tracked down in Russia by digital sleuths
2024-03-01,Russia's 'VPN Ban' is Live as Authorities Warn of Bad VPNs & U.S. Spying
2024-02-20,Kremlin rejects call for international investigation into Alexei Navalny's death
2024-02-13,"Russia preparing for military confrontation with West, says Estonia"
2024-02-15,"‘Hamas is not a terrorist group,’ says UN Relief Chief Martin Griffiths"
2024-02-15,IDF kills Hamas commander who held murdered hostage in Gaza hospital
2024-02-18,Russia takes control of the city of Avdiivka in eastern Ukraine after Ukrainian troops withdraw
2024-03-09,"Russia reports drone attack on Taganrog, aircraft factory damaged"
2024-02-15,Ukraine Sends More Troops to 'Extremely Critical' Avdiivka
2024-02-21,"Hamas chief Sinwar's health deteriorates, suffering from severe pneumonia - report"
2024-02-14,Putin Signs Law on Seizing Property of Ukraine War Critics
2024-03-01,"Bedbug panic was stoked by Russia, says France"
2024-02-12,UNRWA chief rebuffs calls to resign over alleged Hamas links
2024-02-12,Israel bars entry to Italian UN official
2024-03-01,French fighter jets intercept Russian aircraft near Poland: reports
2024-02-15,Helmets and Vests found in aid trucks to Gaza.
2024-03-07,Houthi missile attack: Two Filipino crew members among those dead
2024-02-14,"People around the world have high levels of trust in scientists, and most want researchers to get more involved in policymaking, a global survey with more than 70,000 participants finds"
2024-02-13,Ukraine says Russia buying Starlink terminals in 'Arab countries'
2024-02-19,Israel’s economy slumps 19.4% in the fourth quarter 2023 as war takes a toll
2024-03-04,43 countries demand international probe into Navalny’s death
2024-02-25,Ukraine-NATO Council: Russia must immediately stop war
2024-03-05,Ukraine war: Kyiv says seven dead as drone attack sinks Russian ship
2024-02-25,Moldovan separatists ask Putin to annexe their region
2024-02-13,European leaders call for stronger defence ties after Trump’s Nato remarks
2024-02-14,First Lesbian Couple Registers Their Marriage In Nepal
2024-02-18,'It is urgent': European leaders appeal for greater support for Ukraine as Russia makes major gain
2024-02-13,Zelenskyy calls for House vote on Ukraine aid
2024-03-03,Zelenskiy Calls On World To Help Ukraine Defeat 'Russian Evil' As Death Toll From Strike On Odesa Climbs To 12
2024-02-17,"Kremlin runs disinformation campaign to undermine Zelensky, documents show"
2024-03-02,Finland sees unprecedented rise in STIs
2024-02-16,U.S. Official Says Iran's Revolutionary Guard Is 'Serving Side-By-Side' With Houthi Rebels In Yemen
2024-03-06,Cameron: London ready to loan Ukraine all frozen Russian assets in UK
2024-02-20,Germany faces a political crisis over sending Taurus cruise missiles to Ukraine
2024-02-29,"Thailand to ban recreational cannabis use by year-end, says health minister"
2024-02-28,Belgium buys 200 million euros’ worth of ammunition for Ukraine
2024-03-06,Czech President on sending troops to Ukraine: Let’s not limit ourselves
2024-02-18,Deputy Prime Minister sends warning to Oslo: Russian rights at Svalbard must not be challenged
2024-02-23,Putin says nearly all of Russia's nuclear forces have been modernised
2024-02-20,Ukraine military says it repelled Russian offensive on southern front
2024-03-06,Armenia Officially Asks Moscow To Remove Russian Border Troops From Yerevan Airport
2024-02-14,Israel Says Wounded Al Jazeera Journalist A Hamas Militant
2024-02-12,Canadian Russian pleads guilty to exporting technology to Russia
2024-02-24,Thousands protest as hunger grows amid Argentine austerity
2024-02-16,"Iran declares Antarctica its property in direct challenge to Biden, global treaty"
2024-03-09,Saudi Arabia Joins Afghanistan And Iran As One of World's Leading Executioners
2024-02-20,"Putin says Russia has no intention of putting nuclear weapons in space, denying US claims"
2024-02-17,"Hamas suspends Gaza ceasefire, hostage deal negotiations with Israel"
2024-03-06,NATO to fly Sweden’s flag on Monday
2024-02-23,Philippines arming up for D-Day with China
2024-02-26,Moscow ally Serbia cracks down on anti-war Russians living in the Balkan country
2024-02-27,"Western troops on the ground in Ukraine is not 'ruled out' in the future, French leader says"
2024-02-14,"Russia can sustain war effort for ‘two or three years,’ finds defense study"
2024-02-15,Spanish citizens feel ‘abandoned’ after 10 months without clean water
2024-02-17,"Germany’s Scholz commits to spending 2% on defense ‘in the 2020s, in the 2030s and beyond’"
2024-02-12,Palestinian released in ceasefire caught trying to sneak into Israel
2024-03-02,Moldova says Russia has no right to lecture on democracy
2024-02-25,Ukraine warns of “retaliatory measures” if Poland does not end farmers’ border blockade
2024-03-07,"Ukrainian POWs are being bought and sold on a Russian black market, report says"
2024-02-25,"Jake Sullivan says U.S., Israel have agreed to 'basic contours' of a cease-fire deal"
2024-03-07,Zelenskyy approves former Commander-in-Chief Zaluzhnyi as Ukraine's ambassador to UK
2024-02-23,UK firms make four-day workweek permanent after world’s biggest trial
2024-02-29,"'We have the Israelis right where we want them,' Sinwar reportedly tells Hamas leadership"
2024-03-07,"UK to send 10,000 drones to Ukraine"
2024-02-21,Feds charge Japanese Yakuza leader with nuclear materials trafficking
2024-02-23,It’s been two years since Russia's full-scale invasion of Ukraine. I lead The Wall Street Journal’s Ukraine coverage. AMA.
2024-03-10,Kyoto bans tourists from parts of geisha district amid reports of bad behaviour | Japan
2024-03-08,"Get Pregnant, Men Have It Worse: Russian Officials React to Women’s Day"
2024-02-11,"Israeli poll: Gantz holds lead over Netanyahu, public wants election - Israel Politics"
2024-02-16,ICJ rejects request to prevent Israeli operation in Rafah
2024-03-06,UN Special Rapporteur 'unaware' of rocket attacks on Israel
2024-02-24,King Charles says Ukraine faces 'indescribable aggression'
2024-03-02,"1 in 5 new car sales globally were EVs in 2023, and that's curbed oil demand"
2024-02-13,Israel releases video apparently showing Hamas leader Sinwar in tunnel
2024-03-10,"Ukraine minister, responding to Pope Francis, says Kyiv will never raise white flag"
2024-03-06,Ukraine’s first lady declines State of the Union invitation
2024-02-12,"NATO Can't Be 'A La Carte,' Borrell Says"
2024-02-15,Top European rights court upholds Belgian ban on kosher slaughter
2024-02-28,South Korea’s fertility rate sinks to record low despite $270bn in incentives
2024-03-09,"U.S. forces, allies shoot down more than 2 dozen Houthi drones in Red Sea"
2024-02-29,Parliament calls on the EU to give Ukraine whatever it needs to defeat Russia
2024-03-04,The Ukrainian intelligence specialists hacked Russiaʼs Ministry of Defense database and gained access to secret documents
2024-02-14,Putin's Black Sea fleet 'suffers fresh blow with large landing ship hit' by Ukrainian sea drones
2024-03-04,"Albania, wary of Russia, reopens Soviet-era air base to NATO"
2024-02-24,Dung dumped outside Russian ambassador's home in Poland on Ukraine war anniversary
2024-02-22,Alexei Navalny’s mother accuses Russian authorities of blackmailing her over son’s funeral
2024-03-01,Two Pakistanis charged over calls for Dutch far-right leader's killing
2024-03-10,"Mossad: Hamas toughening demands for hostage deal, seeks Ramadan escalation"
2024-02-16,Israel blasts top UN aid official after he says ‘Hamas is not a terrorist group for us’
2024-02-15,Estonia Says Russia Is Preparing For A Military Confrontation With The West
2024-02-27,European Parliament approves 50 billion euro package for Ukraine
2024-02-25,"Netanyahu: ‘Delusional claims’ from Hamas stopping cease-fire deal, ‘They’re on another planet’"
2024-03-04,Rinkevics to Musk: Reason NATO exists is Russia and other enemies of the free world
2024-03-02,Navalny's mother brings flowers to his grave a day after thousands attended his funeral in Moscow
2024-03-08,CBI busts human trafficking network taking Indians to Russia-Ukraine war zone
2024-02-12,"Dozens of civilians killed by Ethiopian state troops in Amhara region, say reports"
2024-02-27,France bans 'steak' label on vegetarian products
2024-02-18,Palestinian factions to meet in Moscow as west rejects Hamas role in ruling Gaza after war
2024-02-19,Armenia is not on Russia's side regarding the Ukraine issue – Armenian PM
2024-02-15,Gazan journalist says Hamas uses civilians as human shields
2024-03-07,Argentina's Milei tells school kids abortion is 'murder'
2024-03-04,"France enshrines 'freedom' to abortion in Constitution, in world first"
2024-02-17,"Russia attempting to develop nuclear space weapon to destroy satellites with massive energy wave, sources familiar with intel say"
2024-03-01,London property tied to Putin ally remains untouched by sanctions
2024-02-13,Angry farmer protests are spreading across Europe — and getting results
2024-02-20,"Russia arrests dual US citizen Ksenia Karelina on accusations of treason for sending $50 to Razom for Ukraine, a nonprofit in New York that sends assistance to Ukraine"
2024-02-11,"Venezuela defends military buildup, accusing neighboring Guyana of granting illegal oil contracts"
2024-02-15,Zelnskyy Signs Law Legalizing Medical Marijuana in Ukraine
2024-02-14,"Northern Israel: 1 dead, 8 wounded following rocket barrage - I24NEWS"
2024-02-24,'Don't lose heart': NATO chief tells Ukraine and allies
2024-02-13,Victims of October 7 demand declaration of UNRWA as terror group
2024-02-24,US and UK carry out fresh strikes on Houthi targets in Yemen
2024-02-18,Ukraine military says it repelled Russian offensive on southern front
2024-03-02,Ukraine official says Russia massing forces around a key city in the country's east
2024-03-03,S. Korea's 1st spy satellite transmits 'good-resolution' images of central Pyongyang
2024-02-11,HMS Prince of Wales fails to depart for Nato exercises - BBC News
2024-02-21,Australian bishop Christopher Saunders has been charged with rape and a string of sex offences - some against children.
2024-02-12,Turkmenistan Conducting Virginity Tests To 'Evaluate Teenagers' Morality'
2024-03-06,Church authorities in Greece slap religious ban on local politicians who backed same-sex marriage
2024-02-21,Israel to open another Gaza border crossing for humanitarian aid - report
2024-02-22,"Initial report from paramedics of suspected terror shooting near Jerusalem, 6 wounded"
2024-03-03,WWF shelved report exposing River Wye pollution ‘to keep Tesco happy’
2024-03-04,"One killed, 7 wounded by anti-tank missile fire in northern Israel"
2024-02-18,Russian forces try to storm Ukrainian positions in Kherson Oblast
2024-02-24,A young Arab woman seeks to make history by being voted into Jerusalem city council
2024-02-29,"‘Everything’ on table to help Ukraine beat Putin, Estonian PM says"
2024-02-28,Israel to transfer early warning systems for missile strikes to Ukraine – rep to UN
2024-02-16,Ukrainian intelligence knows who poisoned spy chief's wife and hints at countermeasures in Russia
2024-02-13,"Yemen's Houthi rebels fire missiles at ship bound for Iran, their main supporter"
2024-02-14,Kremlin denies Reuters report that Putin offered a ceasefire in Ukraine
2024-02-13,Global military spending hits record $2.2 trillion amid multiple wars
2024-02-11,Japan to pledge $106 mln in aid to Ukraine -Kyodo News
2024-02-25,"Hezbollah fires rockets, drone at Galilee as Israeli jets pounds southern Lebanon"
2024-02-17,Houthi attacks in Red Sea having a ‘catastrophic’ effect on aid to Sudan
2024-03-10,Homophobic Attack Days After Greece's First Gay Marriage Sparks Outrage
2024-03-05,"Japan eyes up to 800,000 more skilled foreign workers over next 5 years"
2024-03-06,Australia man who allegedly zip tied young Indigenous children's hands charged with assault
2024-02-29,Amazon lobbyists banned from European Parliament
2024-02-22,"US promises new sanctions on Iran for its support of Russia's war in Ukraine, potential missile sale"
2024-02-18,US to block UN resolution for Gaza ceasefire as Israel bombs Rafah
2024-02-21,Turkey’s fifth-generation fighter plane takes off for maiden flight
2024-02-25,Ukraine's Defence Intelligence chief claims Navalny died of natural causes
2024-02-20,Kremlin rejects call for independent postmortem on opposition leader Alexei Navalny
2024-02-14,"NY Times: Tunnel under Al-Shifa Hospital used by Hamas ‘for cover, weapons storage’"
2024-02-12,"Revealed: the 1,200 big methane leaks from waste dumps trashing the planet"
2024-03-10,Orbán describes Trump's in-depth plans to end Ukrainian war: he won't give a penny
2024-03-05,Twenty thousand NATO troops join Dragon 24 exercises in Poland
2024-03-05,Kremlin 'Has Nothing to Say' About Large Crowds at Navalny Gravesite
2024-02-20,CCTV cameras appear to capture Navalny's body being transported in midnight convoy
2024-03-03,"2 Scientists in Canada Passed On Secrets to China, Investigations Find"
2024-03-01,North Korea's arms supply to Russia must be halted: Czech top diplomat
2024-02-28,British lawmakers fear for their safety after threats and abuse over Gaza
2024-02-18,"Qatari PM: Hostage deal shouldn’t be condition for truce, talks ‘not very promising’"
2024-02-20,Canada sending more than 800 drones to Ukraine to support its fight against Russia
2024-03-04,Europe Steps in as US Dithers: Czechia Says More Ammo Will Arrive in Weeks
2024-03-05,"/r/WorldNews Live Thread: Russian Invasion of Ukraine Day 741, Part 1 (Thread #887)"
2024-03-04,More than 2 million research papers have disappeared from the Internet
2024-03-05,"The Arctic Ocean could be ‘ice-free’ within the decade, researchers warn"
2024-03-05,"EU reached a provisional agreement to ban goods made using forced labour, advancing legislation that was broadly written with China’s Xinjiang in mind"
2024-03-02,Ukraine recognises Ingushetia’s right to self-determination
2024-02-12,Houthis Claim Missile Strike On ‘American Ship’ In Red Sea—But U.K. Navy Says Cargo Ship Received Minor Damages
2024-02-18,"Ukraine accuses Russia of executing injured prisoners at Avdiivka, Vesele"
2024-02-17,Parts of Australia to soar over 50 degrees as heatwave grips state
2024-02-25,Ukraine’s defence minister says half of western arms arrive later than promised
2024-03-05,South Korea begins licence suspension process against striking doctors
2024-02-27,Macron announces coalition to send Kyiv long-range missiles
2024-02-29,France weighing sending soldiers to Ukraine for strategic border control or airspace protection – PM
2024-02-18,Japan to launch world’s first wooden satellite to combat space pollution
2024-03-03,Moldova says Russia has no right to lecture on democracy - SWI swissinfo.ch
2024-03-09,Latvian Premier Slams Putin for Intimidating Russia’s Neighbors
2024-03-03,Germany's defence minister says wiretapping case is 'hybrid attack'
2024-03-05,EU aims to shift European arms industry to ‘war economy mode’
2024-02-15,"Ukraine withdraws units from parts of Avdiivka, sends in crack brigade | Reuters"
2024-02-27,"Navalny ally urges Russians to join election day protest in his memory, drawing Kremlin ire"
2024-02-21,"Houthis Fire at Ship Carrying Humanitarian Aid to Yemen, US Says"
2024-02-29,23 European Parliaments Unite in Open Letter Urging US House Speaker to Provide Aid for Ukraine
2024-03-03,Hamas delegation arrives for Gaza ceasefire talks in Cairo
2024-03-03,Singapore to Build World’s Largest Facility to Remove Carbon From the Ocean
2024-03-02,Bulgaria will stop importing Russian oil
2024-02-15,IDF investigation: At least 10 hostages held in Khan Younis hospital
2024-02-24,"/r/WorldNews Live Thread: Russian Invasion of Ukraine Day 731, Part 1 (Thread #877)"
2024-02-12,Germany starts work on ammo factory to counter new threats
2024-02-18,India freezes accounts of main opposition Congress party
2024-02-11,"Fate of Avdiivka uncertain as Ukrainian forces defending it struggle with fortifications, resources"
2024-03-02,Germany confirms bugging of Bundeswehr Ukraine war talks
2024-03-10,US military ship heading to Gaza to build port
2024-02-29,Masked men in Gaza enforce prices in street markets
2024-02-22,Russian priests sign open letter calling for Navalny’s body to be released to family
2024-02-23,Zelensky: All Ukrainians waiting for first F-16 fighters to arrive
2024-03-08,"Russian state-backed hackers breached Microsoft's core software systems, company says"
2024-03-02,"No evidence of fraud in weapons to Ukraine, watchdog says"
2024-02-14,"/r/WorldNews Live Thread: Russian Invasion of Ukraine Day 721, Part 1 (Thread #867)"
2024-03-06,Russian missile landed hundreds of feet from Zelenskyy in Odesa
2024-03-01,Russia Beefs Up Disinformation About US Chemical Weapons in Ukraine
2024-02-29,Ukrainian elite brigade liberates Krasnohorivka near Donetsk
2024-02-23,"Hungarian foreign minister visiting Iran for trade negotiations ""forgot"" that Tehran supplies Russia with weapons"
2024-03-08,"French arms companies to manufacture directly on Ukrainian soil, defence minister says"
2024-03-08,Families of hostages taken by Hamas receive sign of life from captives - report
2024-02-12,"/r/WorldNews Live Thread: Russian Invasion of Ukraine Day 719, Part 1 (Thread #865)"
2024-02-24,Yulia Navalnaya demands ’Satanic’ Putin release her husband’s body
2024-02-28,"Lithuania to require 18,000 Belarusians to indicate view on Russian invasion of Ukraine"
2024-03-04,"/r/WorldNews Live Thread: Russian Invasion of Ukraine Day 740, Part 1 (Thread #886)"
2024-03-04,"French lawmakers are expected Monday to anchor the right to abortion in the country's constitution, in a global first that has garnered overwhelming public support"
2024-03-03,"/r/WorldNews Live Thread: Russian Invasion of Ukraine Day 739, Part 1 (Thread #885)"
2024-02-20,"Death of Ivan Sechin, son of Putin's ally and Rosneft CEO, under suspicious circumstances"
2024-03-03,Seoul steps up clampdown on ‘dumping tours’ targeting Chinese visitors
2024-02-19,Atlantic ‘hurricane alley’ sees ominous mid-July heat in February
2024-02-19,"/r/WorldNews Live Thread: Russian Invasion of Ukraine Day 726, Part 1 (Thread #872)"
2024-02-16,"/r/WorldNews Live Thread: Russian Invasion of Ukraine Day 723, Part 1 (Thread #869)"
2024-02-23,G20 says two-state solution only answer to Israel-Palestinian conflict
2024-02-20,"/r/WorldNews Live Thread: Russian Invasion of Ukraine Day 727, Part 1 (Thread #873)"
2024-03-01,Poland signs $2.5bn deal with US for air defence system
2024-02-23,"Hungary buys Swedish fighter jets, prepares to approve NATO bid"
2024-02-15,"Backdoors that let cops decrypt messages violate human rights, EU court says"
2024-02-28,"/r/WorldNews Live Thread: Russian Invasion of Ukraine Day 735, Part 1 (Thread #881)"
2024-02-26,"/r/WorldNews Live Thread: Russian Invasion of Ukraine Day 733, Part 1 (Thread #879)"
2024-02-29,Former ballerina detained in Russia has appeal denied in Siberian court
2024-03-02,"/r/WorldNews Live Thread: Russian Invasion of Ukraine Day 738, Part 1 (Thread #884)"
2024-02-28,Bangladesh Bans Capture and Exploitation of Wild Asian Elephants
2024-02-22,Denmark Signs 10-year Security Agreement With Ukraine
2024-02-12,Israel to act on soldier misconduct after BBC investigation
2024-03-07,"/r/WorldNews Live Thread: Russian Invasion of Ukraine Day 743, Part 1 (Thread #889)"
2024-02-26,Several Indians discharged from Russian army following India's demand: MEA
2024-02-13,"/r/WorldNews Live Thread: Russian Invasion of Ukraine Day 720, Part 1 (Thread #866)"
2024-02-21,"/r/WorldNews Live Thread: Russian Invasion of Ukraine Day 728, Part 1 (Thread #874)"
2024-03-01,"/r/WorldNews Live Thread: Russian Invasion of Ukraine Day 737, Part 1 (Thread #883)"
2024-03-06,"/r/WorldNews Live Thread: Russian Invasion of Ukraine Day 742, Part 1 (Thread #888)"
2024-02-20,Sweden boosts military aid to Ukraine with $682 million armament package
2024-02-16,Netanyahu rejects unilateral Palestinian statehood after Biden call
2024-02-18,Rheinmetall to open ammo factory in Ukraine in joint project
2024-03-04,Mental health leave offered to Taiwanese students as youth suicides double
2024-02-17,"/r/WorldNews Live Thread: Russian Invasion of Ukraine Day 724, Part 1 (Thread #870)"
2024-02-29,"/r/WorldNews Live Thread: Russian Invasion of Ukraine Day 736, Part 1 (Thread #882)"
2024-02-15,"/r/WorldNews Live Thread: Russian Invasion of Ukraine Day 722, Part 1 (Thread #868)"
2024-02-13,ICC Prosecutor threatens Israel with war crimes scrutiny if it invades Rafah
2024-02-27,"/r/WorldNews Live Thread: Russian Invasion of Ukraine Day 734, Part 1 (Thread #880)"
2024-02-23,"/r/WorldNews Live Thread: Russian Invasion of Ukraine Day 730, Part 1 (Thread #876)"
2024-02-26,"IDF says it uncovered major Gaza tunnel passing under hospital, university"
2024-02-25,"/r/WorldNews Live Thread: Russian Invasion of Ukraine Day 732, Part 1 (Thread #878)"
2024-02-18,"/r/WorldNews Live Thread: Russian Invasion of Ukraine Day 725, Part 1 (Thread #871)"
2024-02-27,New Zealand set to scrap world-first tobacco ban
2024-03-10,Russia’s new guided bomb inflicts devastation and heavy casualties on the Ukrainian frontlines 
2024-02-15,Japan loses crown as world’s third-largest economy after it slips into recession
