Date,News
2024-02-13,A new report says the world faces a ‘dangerous decade’ as instability and military spending rise
2024-02-22,Stoltenberg: Ukraine’s right to self-defense includes F-16 strikes on legitimate Russian military targets outside Ukraine
2024-02-22,U.S. Navy petty officer based in Japan charged with espionage
2024-02-22,"/r/WorldNews Live Thread: Russian Invasion of Ukraine Day 729, Part 1 (Thread #875)"
2024-02-24,"EU to send almost 170,000 shells to Ukraine by end of March - Kuleba"
2024-03-09,"/r/WorldNews Live Thread: Russian Invasion of Ukraine Day 745, Part 1 (Thread #891)"
2024-02-28,'Lebanon will be next': Iran greenlights Hezbollah attack on Israel - report
2024-02-19,Canada donating hundreds of drones to help war effort in Ukraine
2024-02-28,U.S. weighs airdropping aid into Gaza as land deliveries slow
2024-02-16,Swedish minister reaffirms willingness to send jets to Ukraine after finalizing NATO bid
2024-03-09,Latvia Urges Citizens to Leave Russia Amid Possible 'Terrorist Attacks'
2024-02-11,Japan allocates US$106 million to aid for Ukraine
2024-02-21,Canada set to help bankroll massive ammunition shipments to Ukraine: sources | CBC News
2024-03-10,"/r/WorldNews Live Thread: Russian Invasion of Ukraine Day 746, Part 1 (Thread #892)"
2024-02-17,Former German spy chief founds new right-wing party
2024-02-11,"/r/WorldNews Live Thread: Russian Invasion of Ukraine Day 718, Part 1 (Thread #864)"
2024-03-05,"Russia using Serbian agent to infiltrate EU bodies, Western intel says"
2024-02-29,Ukraine war: Indians ‘duped’ by agents into fighting for Russia
2024-02-24,"More than 1,000 arrested as China cracks down on rare protests in Tibet"
2024-03-10,Ukrainian court seizes woman’s property for supporting Russia
2024-02-24,Four Western leaders arrive in Kyiv to show solidarity on 2nd war anniversary
2024-03-06,Big Tech firms beat lawsuit from child laborers forced to work in cobalt mines
2024-03-10,Vital Russian Supply Lines In Black Sea Cut By Ukrainian Drones
2024-03-08,"Russia Pits Democratic Leaders Against Each Other, Romania Warns - BNN Bloomberg"
2024-02-20,"Farmers have interrupted transport of Ukrainian produce entering Poland, claiming unfair competition from cheaper goods. Meanwhile, tractors blocked city streets and major highways across the country"
2024-03-04,Dozens of koalas allegedly killed or injured during plantation logging on Kangaroo Island
2024-03-08,"/r/WorldNews Live Thread: Russian Invasion of Ukraine Day 744, Part 1 (Thread #890)"
2024-03-05,Russia communist wing asks for probe into West's possible involvement in Stalin's death
2024-02-22,"Polish farmers’ protests “possibly influenced by Russian agents”, says foreign ministry after pro-Putin banner"
2024-02-13,Russia puts leader of NATO member Estonia on wanted list over removal of Soviet-era monuments
2024-03-06,Yulia Navalnaya calls on Russians to protest against Putin by heading to the polls at noon
2024-02-24,"China arrests more than 1,000 Tibetans protesting Chinese dam project"
2024-03-05,"Fears of marine disaster loom after fertilizer-laden ship sinks in Red Sea: The MV Rubymar, a cargo ship carrying about 21,000 metric tons of ammonium phosphate sulfate fertilizer, has sunk in the Red Sea following an attack by Yemen’s Houthi rebels"
2024-02-29,"Pro-Russian Narratives Rise Among Latin American X Users, Research Shows"
2024-03-03,Trudeau's Toronto event with Italy PM Meloni cancelled due to pro-Palestinian protest
2024-02-21,"Mexican police confirm grisly gang video showing bodies kicked, burned and shot"
2024-03-07,Czech Republic to suspend talks with Slovakia over Russia ties
2024-03-09,Royal Navy warship shoots down Houthi drones in Red Sea
2024-03-04,EU may use Russian assets to procure weapons for Ukraine - Euractiv
2024-02-19,‘Europe must defend itself’: shadow of war in Ukraine looms over security conference
2024-02-12,"Hottest January on record sees the world reach 1.7°C warming mark | January was the hottest on record, at 1.7°C above the pre-industrial average for the month. This means there has been a 12-month period in which average global surface temperature was more than 1.5°C above the 1850 to 1900 average"
2024-02-15,"Iran-backed Houthi rebels are seizing on the Israel-Hamas war to recruit more child soldiers, watchdog reports"
2024-03-10,"North Korean missiles developed with foreign help, Nikkei finds. Study shows China co-authored academic papers that may violate U.N. sanctions"
2024-03-04,Europe’s Socialists scramble for ideas to fight far-right surge
2024-02-19,EU moves closer to new Russia sanctions as Navalny widow pins blame on Putin
2024-02-17,Russia’s Opposition in Exile Calls on EU Not to Recognize Putin’s Election - The Moscow Times
2024-02-19,Brazil recalls ambassador to Israel in row over Lula's Gaza comments
2024-02-29,Russian President Putin warns of nuclear war risk if NATO troops are sent to Ukraine
2024-02-11,Finland votes: Stubb wins presidency
2024-02-29,Utility solar dethrones coal as the cheapest power source in Asia
2024-02-28,Navalny’s Widow Says ‘Mobster’ Putin Must Pay as Funeral Set
2024-02-24,Gigantic new anaconda species discovered in Amazon rainforest
2024-02-22,Denmark announces new aid package for Ukraine and F-16 delivery
2024-03-09,"Armenia is considering seeking EU membership, foreign minister says"
2024-02-11,Biden warns Netanyahu against Rafah operation without ‘credible’ safety plan
2024-02-22,UK quits treaty that lets fossil fuel firms sue governments over climate policies
2024-02-16,"Ebola vaccine halves the chance of dying from the disease, says new study"
2024-03-05,"Ukrainian sea drones damage Russian Black Sea fleet patrol ship near Crimea, Ukraine says"
2024-02-16,Macron says recognizing a Palestinian state 'not a taboo' for France
2024-03-07,Poland sees its most violent farmers' protest yet as anger grows across Europe
2024-02-25,Astronomers spot new tiny moons around Neptune and Uranus
2024-02-18,"Large Antigovernment Protest Returns to Tel Aviv, as Criticism of Netanyahu Mounts"
2024-02-14,Families of Gaza hostages head to ICC to file charges against Hamas
2024-03-01,Netherlands signs 10-year security deal with Ukraine during Dutch PM's Kharkiv visit
2024-02-29,Quebec Court of Appeal rules that secularism law is constitutional
2024-02-14,US government guarantees EU’s gas supply: ‘We have more than adequate capacity to cover their needs’
2024-02-25,Hungary set to remove final barrier to Sweden joining Nato | Nato
2024-03-10,Russian Student Jailed 10 Days for Pro-Ukraine WiFi Network Name
2024-03-07,Kim Jong Un Observes Training to Storm Border Posts in War Prep
2024-02-13,France accuses Russia of a disinformation campaign in a key election year
2024-03-03,South Korean doctors holds a mass rally against medical policy
2024-02-24,Sweden: Eight in hospital after reports of unusual smell at Security Service headquarters
2024-02-15,France and Ukraine to sign a security agreement in Paris in the presence of President Zelenskyy
2024-02-16,Zelensky signs law legalizing medical cannabis
2024-02-18,"UK, Allies Look to Arm Ukraine With New AI-Enabled Swarm Drones"
2024-02-29,Lithuanian Foreign Minister considers Macron's idea of Western troops in Ukraine worthy of attention
2024-02-29,"Secret military files reveal when Russia would consider using nuclear weapons, including the destruction of 20% of its ballistic missile submarines: FT"
2024-03-10,Qatar threatens expulsion of Hamas leaders over lack of negotiation progress - report - I24NEWS
2024-02-16,Iran Navy’s Plan To Establish A Military Presence In Antarctica Sparks Global Concerns
2024-03-09,Gold sculptures worth more than $1.3 million stolen from Italian art exhibition
2024-03-07,France's Macron states 'unwavering support' for Moldova in face of Russian menace
2024-02-27,Biden warns Israel of diminishing international support over Gaza offensive in interview with Seth Meyers | CNN Politics
2024-02-16,"Ukraine's Zelenskiy heads to Berlin, Paris to drum up wartime aid"
2024-02-14,"Two Chinese fishermen die after chase with Taiwan's Coast Guard, which alleges trespassing"
2024-02-29,More Than 100 Apparently New Species Found in Deep Sea off Chile
2024-02-26,Ukraine's Zelenskiy urges 'fight' for Crimea after 10 years of occupation
2024-02-11,Duolingo referred to Russia’s media watchdog over ‘LGBT propaganda’
2024-02-15,Stoltenberg: Ukraine to receive 1 million drones from allies in 2024
2024-02-20,"From prison, Navalny ally Ilya Yashin accuses Putin of murder, vows to fight on  "
2024-02-26,"EU sanctions on Russia ‘massively circumvented’ via third countries, study finds"
2024-03-08,UN: Iran committed crimes against humanity during protest crackdown
2024-02-19,'Hostile elements' attempted to take over Israeli flight from Thailand
2024-03-06,At least 18 people searching for truffles in the Syrian desert have been killed by suspected Islamic State (IS) group gunmen
2024-03-02,Germany to investigate leak of high-level army discussions about sending cruise missiles to Ukraine
2024-02-16,970-metre-long prehistoric megastructure found submerged in Baltic Sea
2024-02-25,Serbia protests after Croatia's foreign minister calls Vučić a Russian 'satellite' in the Balkans
2024-02-16,"Iran’s Revolutionary Guard On The Ground In Yemen To Assist Houthis, U.S. Official Says"
2024-02-15,Greece Legalizes Same-sex Marriage and Adoption
2024-03-06,"Russian warship arrives in Qatar for defence exhibition, Interfax reports | Reuters"
2024-02-13,Canada: second Sikh activist’s house hit by gunfire this month
2024-02-16,Russia tightens the noose on Ukraine's city of Avdiivka where outnumbered defenders are holding out
2024-02-12,"World temperatures go above 1.5 C warming threshold for a year: climate scientists | For the first time on record, global warming has exceeded temperatures of 1.5 C over a 12-month period, European Union climate scientists reported this week."
2024-03-07,The planet just shattered heat records for the ninth month in a row
2024-02-13,Climate experts sound alarm over thriving plant life at Greenland ice sheet
2024-02-17,"Hungary can ratify Sweden’s NATO bid as soon as Feb 26, Orban says"
2024-03-08,Mass die-offs among farmed salmon on the rise around the world
2024-02-12,"Ukraine to produce thousands of long-range drones in 2024, minister says"
2024-03-04,Germany accuses Russia of 'information war' after spy leak
2024-02-24,Delhi approaches Moscow for early discharge of Indian ‘army helpers’
2024-02-21,Trident missile misfired and crashed into ocean during rare test launch
2024-02-23,South Korea doctors’ strike: ‘severe’ public health alert issued for first time
2024-02-21,Police searched alleged Chinese overseas police base in Tokyo
2024-02-17,'Zombie Fires' burning at an alarming rate in Canada
2024-03-04,Poland buys Saab grenade launchers in $1.63 billion deal
2024-02-17,Senior Pakistan official admits election rigging as protests grip country
2024-03-05,Poland signs €1.5bn arms deal with Sweden as it welcomes incoming NATO ally
2024-02-26,Hello Kitty theme park in Tokyo closed after ‘terrorist threat’
2024-02-19,Iran commander requests Iraqi militia groups to “dial down attacks on US troops”
2024-03-09,"South Korea and Cuba establish ties, rattling North Korea "
2024-02-25,"Iran conducts another military strike inside Pakistan, attacks terrorist group"
2024-02-27,2 million animals dead as extreme winter weather hits Mongolia
2024-02-22,Russia Threatens Moldova With ‘Military Scenario’ Over Transnistria
2024-02-16,Israel finds boxes of medicine intended for Gaza hostages in hospital
2024-02-14,"Russia may double forces on NATO borders, Estonia warns"
2024-02-20,Yulia Navalnaya urges EU not to recognise Putin’s ‘fake elections’
2024-03-02,Leaked audio shows Germany discussed possible Taurus missiles delivery to Ukraine: Reports
2024-02-25,Only Ukraine's invitation to NATO will give the world real chances to return to true security – Yermak
2024-02-18,Britain lets Ukrainian refugees stay for another 18 months
2024-02-29,Macron’s plan for Western troops in Ukraine ‘well worth considering’ – Lithuanian Foreign Minister
2024-02-14,Pro-Palestinian protestors removed from Parliament after interrupting proceedings
2024-02-18,German city of Dresden commemorates WWII bombing
2024-03-04,"Putin ally Medvedev says Ukraine is 'definitely Russia', rules out talks with Zelenskiy"
2024-03-04,UK ministers consider ban on MPs engaging with pro-Palestine and climate protesters | Protest
2024-02-23,Israeli researchers find breakthrough in lab-made sperm for infertile couples
2024-03-10,"Ukraine to receive 6 bln euro from EU in next two months, PM says"
2024-02-18,Israeli flight from Thailand faced attack by 'hostile elements' - report
2024-02-16,Climate experts sound alarm over thriving plant life at Greenland ice sheet
2024-02-23,Smartphones to be banned in Italian classrooms
2024-03-05,"Belgium deported 'dozens of Russian spies' in recent months, De Croo says"
2024-03-01,Canada considers deployment of non-combat units to Ukraine under specific conditions
2024-02-18,"This Ancient Cave Art Passed Survival Information Across 130 Human Generations in Patagonia, Study Suggests"
2024-02-19,Poland's new government deprograms its once far-right public media
2024-02-19,Israel opposes 'unilateral' imposition of Palestinian state
2024-02-28,Breakaway Moldovan Region Asks Russia For 'Protection'
2024-02-20,Astronomers discover universe’s brightest object – a quasar powered by a black hole that eats a sun a day
2024-02-14,Britain's tea supply facing disruption from Red Sea crisis
2024-02-16,"Drones, armored vehicles and ammunition: Germany has sent another batch of military aid to Ukraine"
2024-03-06,"Ukraine’s Allies Line Up Funds for 800,000 Artillery Shells"
2024-02-13,Hezbollah chief says won’t stop shelling north until Israel ends Gaza ‘aggression’
2024-02-20,Russian ambassador booed in Poland at commemoration of Soviet general
2024-03-07,"UK to supply more than 10,000 drones to Ukraine"
2024-02-28,Government Study Shows Iranians Less Religious Than Before
2024-03-08,Canada sanctions Iranians accused of violently repressing women and girls
2024-03-02,"Putin Bears 'Criminal' Blame for Navalny's Death, EU Lawmakers Say"
2024-02-24,Orban Gives Green Light to Sweden’s NATO Bid - New York Times
2024-02-28,French Senate to vote on enshrining abortion rights in constitution
2024-02-12,Thousands of UK Deliveroo and Uber Eats drivers to strike on Valentine’s Day
2024-03-02,"Gardens in England and Wales blooming four weeks early, says National Trust"
2024-03-09,RCMP commissioner says Mounties have 'credible' info about alleged Chinese 'police stations'
2024-03-06,"Top Haitian gang leader warns of civil war, genocide unless PM resigns"
2024-02-26,ADHD linked to evolutionary success in ancient humans
2024-02-22,"Cargo ship fractures bridge in Guangzhou, sending vehicles into the water below"
2024-02-17,Top UN court rejects South African request for urgent measures to safeguard Rafah
2024-03-10,"Plane veered off flight path after both pilots fell asleep, Indonesian authorities say | CNN"
2024-02-20,Ukraine thwarts wave Of Russian attacks In Zaporizhzhia
2024-03-02,"Oil spill, fertilizer leak from sinking of cargo ship highlight risks to Red Sea from Houthi attacks"
2024-02-18,"Avdiivka, Longtime Stronghold for Ukraine, Falls to Russians"
2024-03-09,Russia mass-producing glide bombs than can destroy a multi-storey building with one hit
2024-02-27,Dutch to give 100 million euros to Czech initiative to buy ammunition for Ukraine
2024-02-24,Scientists announce discovery of 'very strange' 240 million-year-old 'Chinese dragon' fossil
2024-02-16,Ukraine's Zelensky to sign security pacts with Germany and France
2024-03-09,Biden says Israel will secure new Gaza pier; Pentagon: It may take 2 months to build
2024-02-21,Pro-war blogger takes own life after propagandists attack Avdiivka post
2024-02-25,Mexican church officials have helped arrange a truce between 2 warring drug cartels
2024-02-20,Iran arresting teens for celebrating soccer loss to Qatar: rights activists
2024-03-03,Police need warrants for Canadians’ IP addresses: top court
2024-02-28,French Senate approves a bill to make abortion a constitutional right
2024-02-24,"U.S. rice exports to Haiti have unhealthy levels of arsenic, study finds"
2024-02-13,Biden touts hostage talks that could yield 6-week cease-fire between Israel and Hamas
2024-03-05,Archaeologists in Panama find ancient tomb filled with gold treasure — and sacrificial victims
2024-03-01,India economy beats expectations with 8.4% growth
2024-02-27,"Israel is ready to pause its war in Gaza during Ramadan if a hostage deal is reached, Biden says"
2024-02-15,"U.S. briefs Canada, other allies about national security concern involving Russia"
2024-02-11,Biden says Israel shouldn't press into Rafah without 'credible' plan to protect civilians
2024-02-17,Tens of thousands protest in Budapest over sexual abuse case pardon
2024-02-29,‘We shall overcome everything together’: Putin tells his people that the West is trying to defeat Russia
2024-03-01,"Shervin Hajipour: Iranian pop star who sang protest anthem jailed and ordered to write anti-US song, rights group says"
2024-02-16,Taliban say they will never recognize the Durand Line as Afghanistan's official border with Pakistan
2024-02-23,Israel Joins Cease-Fire Talks in Paris
2024-02-19,Russian probe into Navalny death extended amid cover-up accusations
2024-02-15,i24NEWS Exclusive: Israel finds 6 drones amid UNRWA donations that entered West Bank this week - I24NEWS
2024-02-22,Romanian Parliament bans sale of energy drinks to minors
2024-02-13,Brussels Proposes Sanctions Against Chinese and Indian Corporations with Ties to Russia
2024-02-26,HUR Chief Budanov Says Seems Navalny Died of Detached Blood Clot
2024-02-25,At least 15 Catholic worshipers killed in attack during a service in Burkina Faso.
2024-02-20,"Alexei Navalny’s body to be held for two weeks for ‘chemical analysis’, family told"
2024-02-23,Armenia suspends participation in Russian-led Collective Security Treaty Organisation
2024-02-27,EU introduces 10 year prison sentences for environmental crimes
2024-02-17,Germany's top security official wants easier ways to track right-wing extremist financing
2024-03-07,"Pavel: Allies collect required funding to purchase 800,000 shells for Ukraine"
2024-03-06,Macron Says France Will Join Czech Ammunition Plan for Kyiv
2024-02-29,European Parliament condemns murder of Alexey Navalny and holds Putin responsible
2024-02-11,/r/WorldNews Live Thread for Israel-Hamas War (Thread 46)
2024-02-19,Ministers confirm plan to ban use of mobile phones in schools in England
2024-02-20,Putin denies plans to send nuclear weapon into space
2024-02-12,French security experts identify Moscow-based disinformation network
2024-02-12,AI ‘resurrects’ long dead dictator in murky new era of deepfake electioneering | CNN
2024-02-28,France issues ban on 'steak' and 'ham' labels for plant-based products
2024-02-16,Russia has already fired 24 North Korean-made ballistic missiles on Ukraine: Prosecutor General explains their specifics
2024-02-18,G7 agrees to continue supporting Ukraine
2024-03-09,Top US cybersecurity agency hacked and forced to take some systems offline | CNN Politics
2024-03-08,Finland to participate in Red Sea operations protecting cargo vessels
2024-02-14,Three guilty of showing support for Hamas at pro-Palestine protest
2024-02-12,EU takes first step to use Russia's frozen assets for Ukraine
2024-03-08,Great Barrier Reef: New mass bleaching event hits World Heritage site
2024-03-08,"In First, Finland Sentences Businessman for Violating Sanctions Against Russia"
2024-02-14,Putin signs law allowing seizure of property for ‘spreading false information’ about military
2024-03-06,US destroyer shoots down missile and drones launched by Yemen’s Houthi rebels
2024-02-17,February on course to break unprecedented number of heat records
2024-03-05,Argentina's Telam news agency suspended in President Melei's crackdown on 'propaganda'
2024-03-03,Japan to revise official romanization rules for first time in 70 years
2024-03-05,UK urges Germany to give long-range missiles to Kyiv despite Luftwaffe leak
2024-02-26,Rights campaigner calls Russia 'fascist' in court
2024-02-19,Thousands protest Mexican President López Obrador’s government in ‘march for democracy’
2024-03-08,"Turkey's Erdogan says March 31 election will be his final, state media reports"
2024-03-07,CNN witnesses maritime confrontations between China and Philippines in the South China Sea | CNN
2024-02-25,PM Orbán with Putin again: Hungary vetoed EU's declaration against Russia
2024-03-03,A young girl died in France after a boat capsized on the English Channel crossing migrant route
2024-02-21,Police interventions fall by half after Polish city of Kraków bans alcohol sales at night
2024-02-27,The 'Doomsday Glacier' is rapidly melting. Scientists now have evidence for when it started and why
2024-02-23,Indian Foreign Ministry urges citizens to avoid joining Russian army in Ukraine conflict
2024-03-05,"Iran supplying Russia with ballistic missiles shows they are 'bad influence' in Europe, Grant Shapps signals | World News"
2024-02-23,Guards at prison where Navalny died allegedly tortured inmate to death in 2022
2024-02-22,Russia 'struggling with supply of weapons and ammunition' for Ukraine war - Western officials
2024-02-20,Estonia's Prime Minister Kaja Kallas said on Tuesday that her country had successfully halted a hybrid operation by Russia's security services on Estonian territory
2024-02-19,U.S. strikes Houthi underwater drone for first time since Red Sea attacks started
2024-02-25,South Korean hospitals extend working hours to tackle doctors' protest
2024-02-28,Ukrainian children recount horrors of being kidnapped by Russian soldiers
2024-03-07,Sweden becomes NATO member as PM Kristersson visits US – DW – 03/07/2024
2024-02-28,Jihadist attacks displace tens of thousands in Mozambique
2024-02-25,"Canada is facing ‘irrelevance’ on world stage, ex-defence chief warns - National | Globalnews.ca"
2024-03-09,"Armenia Considering EU Membership, Foreign Minister Says"
2024-03-03,Japan city to require multilingual trash rules posted for foreigners
2024-02-29,Poland detains Russian on charges of working with ISIS
2024-02-16,"Egypt building wall and clearing land on Gaza border, satellite images and footage show"
2024-02-25,Sadiq Khan urges Government to do more to combat London property owners with links to the Kremlin
2024-02-11,Costa Rica guarantees fair compensation and benefits for coffee pickers
2024-02-25,March held in Taipei to support Ukraine on anniversary of Russia's invasion 
2024-03-06,Prague and Berlin zoos to reintroduce endangered Przewalki's horses to Kazakhstan
2024-02-26,Military intelligence: Russia plans to produce 2.7 million shells this year. We had better get ahead of them.
2024-03-04,"With Sinwar incommunicado, mediators warn hostage deal could be delayed"
2024-03-08,"The number of female genital mutilation survivors tops 230 million worldwide, UNICEF said in a new report Thursday, an increase of 15 percent since 2016 despite progress against the practice in some countries"
2024-02-23,France blames Russia’s FSB for anti-Semitic Star of David graffiti campaign
2024-03-10,Navalny Parents Thank Crowds Paying Respects to Him
2024-02-22,IDF said advancing Gaza City pilot to have unaffiliated locals take over governance
2024-02-27,"Conservationists raised the alarm on Tuesday as South Africa reported a sharp increase in rhino poaching, with almost 500 animals killed last year"
2024-02-17,India: Right to peaceful protest under threat due to mounting restrictions and escalating crackdown on farmers’ march
2024-02-13,"Meta Removes 795,000 Posts After EU Rebuke on Hamas Content"
2024-03-02,"Singapore court upholds death penalty, rejects heroin trafficker’s claim he thought it was cannabis"
2024-02-16,NATO/Ukraine training center to be established in Poland
2024-03-06,Red panda found in luggage at Bangkok airport
2024-02-25,Israel vows to target Lebanon's Hezbollah even if temporary pause reached with Hamas in Gaza
2024-03-04,"In ‘unprecedented action’, US to probe Chinese tech in cars over security risks"
2024-02-12,Russian attack drone operators being trained in Syria
2024-03-02,The Dutch government has spent $180M dealing with the downing of a Malaysia Airlines flight in 2014 | AP News
2024-02-25,US and British struck 18 Houthi sites in Yemen in response to militants' surge in Red Sea attacks on ships
2024-03-03,Netanyahu rival’s visit to U.S. highlights cracks within Israel’s wartime leadership
2024-02-22,Ukraine’s air defenses shoot down 8 out of 10 enemy Shahed UAVs overnight
2024-02-29,"Canada fired two scientists for sharing information with Beijing, says paper"
2024-03-09,"Aid ship to leave Cyprus for Gaza within 24 hours, Christodoulides says"
2024-03-11,"Netanyahu says at least 13,000 'terrorists' among Palestinians killed"
2024-02-26,"Germany, India holding secret talks on purchase of shells for Ukrainian Armed Forces"
2024-03-01,UK Is Pushing Germany to Send Taurus Missiles to Ukraine
2024-02-28,Alexei Navalny to be buried on Friday in Moscow
2024-02-19,Tests on Alexei Navalny's body to take 14 days - ally
2024-02-15,UK economy slipped into technical recession at the end of 2023
2024-02-27,Poland calls for transfer of frozen Russian assets to Ukraine
2024-03-06,"At least 27,000 people estimated to have visited Navalny’s grave in days following funeral"
2024-03-01,Switzerland implements new sanctions against Russia
2024-02-20,WikiLeaks founder Assange starts final U.K. legal battle to avoid extradition to U.S. on spy charges
