Date,News
2024-03-02,"Philippines, India, Japan eye trilateral grouping"
2024-02-12,Chief of UN aid agency in Gaza calls EU funds 'absolutely critical' but the bloc wants an audit
2024-02-16,UN chief warns climate chaos and food crises threaten global peace: 'Empty bellies fuel unrest'
2024-02-11,Nigeria: Dozens arrested for attending gay weddings
2024-02-23,Zelenskyy on corruption in Ukraine: ''Everything is clean''
2024-03-08,"Safety at Zaporizhzhia nuclear plant worsening, Ukraine says"
2024-03-02,France blames bed bug panic on Russian 'disinformation'
2024-02-13,Police in the Swiss ski resort of Davos are investigating reports that a ski rental store was refusing to sell equipment to Jewish people
2024-02-27,"Russian Red Cross has pro-Kremlin bias, conducts military fundraising and abuse Ukrainian POWs"
2024-02-22,"Governments around the world are ""reaching beyond their borders"" to attack their own citizens abroad in order to crush dissent, Human Rights Watch said Thursday, urging more protection for them"
2024-03-07,"Human-caused climate change fuels hottest February on record, all-time high ocean warming"
2024-02-15,Greece Is Set to Be First Orthodox Country to Allow Same-Sex Marriage
2024-03-01,Switzerland joins EU in expanding sanctions against Russia
2024-03-08,EU Aims to Move Forward With Ukraine Accession Talks Next Week
2024-03-03,"Thousands of Israeli demonstrators thronged a Jerusalem square on Saturday, concluding a four-day march from the Gaza border intended to pressure the government to free hostages held in the Palestinian territory"
2024-02-19,U.S. Proposes UN Security Council Oppose Rafah Assault
2024-03-05,Germany not to allow Russian propaganda to shift focus from aid to Ukraine
2024-02-16,"Germany signs long-term security deal with Ukraine, unveils new aid package"
2024-03-05,Netanyahu rejects Ben Gvir’s proposal: No change to Temple Mount prayer numbers for first week of Ramadan
2024-02-24,Dutch far-right leader Wilders against signing security agreement with Ukraine
2024-02-27,Hungary's most important national security concern is not to share a border with Russia – Orbán at V4 summit
2024-02-16,AI hiring tools may be filtering out the best job applicants
2024-02-15,"Pakistan politician gives up seat, saying vote was rigged in his favor"
2024-02-11,New UN weather agency chief says rate of global warming is speeding up
2024-03-04,"Covid-19 increases risk of developing autoimmune disease, but vaccination helps, large study shows"
2024-02-14,"Russian Artist Threatens to Dissolve $45 M. of Artworks by Picasso, Rembrandt if Julian Assange Dies in Prison"
2024-02-23,Bolsonaro Coup Plans: U.S. Pressure Campaign Kept Brazil's Generals at Bay
2024-03-06,The Philippines says it won't let China remove a Filipino military outpost on a disputed shoal
2024-02-21,"Argentina's poverty levels hit 57% of population, a 20-year high in January"
2024-02-27,Mexico City may be just months away from running of out water | CNN
2024-02-24,"PM: It is not only Ukraine's struggle, but also important values we defend"
2024-03-01,First Nations who've gone years without clean drinking water hope compensation signals a 'new dawn'
2024-02-28,"Navalny to be buried in Moscow on Friday, wife fears possible arrests"
2024-02-24,"“the U.S. will have to give up its global leadership if it gives into North Korean extortion”,South Korean defense minister said"
2024-03-02,Tibetans in India march in solidarity with those arrested in dam protest in China
2024-02-25,"Russian reconnaissance drone tracks Baerbock column, Mykolaiv visit aborted"
2024-02-23,US working to provide Ukraine with longer-range ATACMS missiles - White House
2024-02-19,"On Valentine’s Day, LGBTQ activists in Japan call for same-sex marriage rights"
2024-02-21,Poland probes pro-Putin banner at farmers' protest
2024-02-16,Neutral Swiss to beef up military spending in wake of Ukraine war
2024-02-20,Special forces blocked UK resettlement applications from elite Afghan troops
2024-02-28,"Singapore to buy eight F-35A fighter jets as defence spending inches up, growing its fleet to 20 F-35s"
2024-02-20,Wife of Haiti's assassinated president amongst dozens indicted in his killing
2024-02-28,Talk of Western troops in Ukraine is a signal to Moscow – Estonian general
2024-02-12,UK sanctions four Israeli settlers accused of violence
2024-03-09,Houthi forces step up Red Sea attacks as US and Denmark shoot down drones
2024-02-18,"Germany: More demos against far-right, AfD slips in polls"
2024-03-07,"France To Sign Defense Deal With Moldova Amid Warnings Of Russian Interference Ahead Of Elections, Referendum"
2024-02-29,President of the Philippines Ferdinand Marcos Jr deepens maritime ties with Australia as he vows not to yield an inch to China
2024-02-22,Germany's Bundestag votes against Taurus missiles to Ukraine
2024-02-11,SSU identifies 5 more Russian military personnel involved in torture of civilians in Sumy region
2024-03-05,Justice Minister defends house arrest power for people feared to commit a hate crime in future
2024-03-01,Cuba asks UN for help as food shortages worsen
2024-02-13,"Netanyahu to Biden: I want a hostage deal, but Hamas's demands are a non-starter"
2024-02-19,Germany seeks new EU sanctions on Russia over Navalny death
2024-02-18,"Ukraine accuses Russia of executing injured prisoners at Avdiivka, Vesele"
2024-02-17,Hungary rocked by protests over child sex abuse pardon case
2024-02-25,Belarus' Lukashenko says he'll run for president in 2025
2024-02-21,Zelenskyy calls for urgent talks to end Polish border crisis
2024-02-11,A Saudi dissident who has unsuccessfully sought asylum in Bulgaria has received a deportation order and now fears he could be sent back to the Gulf kingdom any day
2024-03-04,Dmitry Medvedev calls for Ukrainian independence to ‘disappear forever’
2024-02-29,Ukraine Sees Risk of Russia Breaking Through Defenses by Summer
2024-02-24,Israel reaches agreement on updated hostage deal outline in Paris talks
2024-02-13,Russia Puts Estonian PM And Dozens Of Baltic Officials On Wanted List For Removing Monuments
2024-03-08,Nigeria's president sends troops to rescue more than 250 kidnapped students
2024-03-05,"Despite UN warnings, Iran’s execution of Kurds and political dissidents continues unchecked"
2024-03-02,Pakistan-bound ship from China stopped in Mumbai on suspicion of 'consignment for nuclear programme'
2024-02-20,Police called to investigate alleged LGBTQ propaganda at Russian ‘My Little Pony’ convention
2024-03-08,"To save water, drought-hit Morocco is closing its famous public baths three days a week"
2024-02-18,"US conducted five self-defense strikes in Houthi-controlled areas of Yemen, military says"
2024-02-25,"Israel plans to build 3,300 new settlement homes in West Bank"
2024-02-15,"Japan slips to the world's fourth-largest economy, behind the US, China and now Germany"
2024-02-29,"Ukraine says it identified 511 war crime suspects, convicted 81"
2024-02-13,Russia Orders Arrest of Meta Exec for 'Extremist Activities'
2024-03-02,India stops Pak-bound ship from China carrying 'military-grade items'
2024-02-23,High-rise complex consumed by fire in Spain was made in 2008 with ‘innovative materials’ by a developer that went bankrupt
2024-02-23,PM: F-16 aircraft from Denmark will appear in Ukraine by summer
2024-03-09,Argentina: Tens of thousands of women challenge President Milei on march for rights
2024-02-20,Hungary’s governing party says it’s ready to approve Sweden’s NATO accession on Monday
2024-02-17,China using cyanide to 'destroy' Scarborough on purpose — BFAR
2024-02-13,Turkey arrests suspected ISIS member working at nuclear plant
2024-02-18,Iraqi armed groups dial down U.S. attacks on request of Iran commander
2024-03-07,Navalny's unreleased interview: 'If they would kill me it changes nothing'
2024-03-02,Hungary's parliament speaker signs off on Sweden's NATO accession
2024-02-22,"Britain’s ‘deep state’ thwarted my plans, Liz Truss tells US hard-right summit"
2024-02-14,Hungary resignations leave Viktor Orban in biggest crisis yet
2024-03-02,"A message to Netanyahu? Gantz to travel to Washington next week | Prime Minister's Office expresses anger and clarified that Gantz is flying without the PM's approval, contrary to the government regulations"
2024-02-16,"India resumes buying Russian Sokol oil after 2-month hiatus, sources say"
2024-03-09,"Israel Arrests Dozens In Biggest Raid On Occupied West Bank In Years, Reports Say"
2024-03-03,"Volcano on uninhabited Galapagos island erupts, sends lava flowing to sea"
2024-02-11,French Interior Minister Gérald Darmanin says France will end birthright citizenship in overseas territory Mayotte
2024-02-24,Singapore's Ministry of Education responds to parents’ criticisms over Israel-Hamas lesson material
2024-03-08,Interest in Canadian schools is fading among Indian students
2024-02-21,Lithuania to close 2 more checkpoints with Russian ally Belarus as tensions along the border rise
2024-02-27,Houthis knock out underwater cables linking Europe to Asia - report
2024-03-04,"Terror cell planning ISIS-style attacks caught with 100 explosive devices, Shin Bet says"
2024-02-26,Bloomberg: Russia buys tens of millions in banned technologies from EU
2024-02-15,"UK could contribute to nuclear shield if Trump wins, suggests German minister"
2024-02-16,Polish prime minister says his country and Finland want changes on EU border policies on migration
2024-02-27,Iran makes surprise cut to stockpile of near-bomb-grade uranium
2024-02-26,"Half of Western military aid not delivered on time, says Ukraine minister"
2024-02-19,Israeli protesters block aid convoys bound for Gaza
2024-02-15,UK antisemitic hate crimes hit new high - report - BBC News
2024-02-12,HMS Prince of Wales sails for key NATO exercise in Norway
2024-02-14,"Academics in the United States, the United Kingdom and Australia collaborated on drone research with Iranian university Sharif University"
2024-03-08,Ukraine war: India busts network trafficking people to Russia
2024-03-05,Albania sets up first NATO base in Western Balkans
2024-02-23,Ukrainian air defenses destroy 23 out of 31 kamikaze drones overnight
2024-03-04,More than 1.3 tons of cocaine seized in the Caribbean Sea as suspects abandon ship
2024-03-04,Canada expanding Russia sanctions over Navalny’s death
2024-03-04,"US, South Korea Start Military Drills Set to Anger Kim Jong Un"
2024-03-05,"Argentina's government on Monday suspended the Telam state news agency in the wake of an announcement by President Javier Milei that he would shut down what he called a mouthpiece of ""propaganda"" for previous leftist administrations"
2024-02-16,Japan OKs plan to boost child allowances to tackle falling birthrate
2024-02-15,Nations receiving US arms told to abide by laws of war
2024-02-27,EU nature law passes to restore 20% of Europe's degraded land and sea
2024-02-12,"Kelvin Kiptum, men's marathon world record holder, dies in a car crash"
2024-02-29,Canada to start airdropping aid into Gaza within days: source
2024-02-27,Swiss exports to Russia suspected of evading sanctions 
2024-02-28,"The number of North Pacific humpback whales plummeted 20 percent in less than a decade, and marine heatwaves may be the main culprit, according to a study released Wednesday that spells a troubled future for the majestic sea mammals"
2024-02-26,G7 promises to increase sanctions and block Russian assets until end of war in Ukraine
2024-02-27,"Already serving a life sentence for his attack on a German synagogue in 2019, the 32-year-old has been handed a further seven years after taking two prison staff hostage and threatening them with a self-made firearm"
2024-02-18,Germany: Number of school dropouts is rising
2024-02-16,"One of the worst methane leaks ever recorded took place last year in Kazakhstan. Estimated 127,000 tonnes of gas escaped."
2024-02-13,Israel to send delegation to Cairo hostage talks as Biden touts push for 6-week pause
2024-02-14,[Exclusive] New EU sanctions: Lukashenko also stealing Ukraine's children
2024-02-25,Top general says US Army would be a key player in a war in Pacific
2024-02-15,Ukraine's second city keeps going despite Russian attacks
2024-03-08,France's defense minister says sending troops to Ukraine 'not on table'
2024-02-22,UK aid supplies air-dropped into Gaza for first time
2024-02-16,"Japan to aid Ukraine in 7 key areas, including with land mines"
2024-02-13,21 black rhinos have been moved to Kenya’s Loisaba Conservancy as the species recovers: This represents a big turnaround for them as the nation's 16 sanctuaries have become stretched
2024-03-03,Swiss ski resort Rüschegg Eywald falls victim to climate change
2024-02-11,"Russia's military drone production ramping up, says defence minister"
2024-03-06,Protesting students use pickup truck to batter down doors at National Palace in Mexico City
2024-02-27,Nato allies reject Emmanuel Macron idea of troops to Ukraine
2024-03-05,Ukraine's GUR hacked the Russian Ministry of Defense
2024-02-14,Germany presents measures to curb far-right
2024-03-09,"The United States unveiled sanctions Friday on two companies over their roles supporting Russian mercenaries the Wagner Group, noting that Moscow has tried to use affiliated businesses to secure revenues and further its interests in Africa"
2024-02-29,Editor of top independent Russian newspaper detained for allegedly discrediting military
2024-02-29,Russian strategic nuclear forces on full alert – Putin
2024-02-14,"US puts sanctions on Central Bank of Iran subsidiary, others"
2024-02-24,US and UK carry out fourth round of coalition strikes against at least a dozen Houthi targets in Yemen | CNN Politics
2024-03-06,"Greece stands with Ukraine, PM says, as Odesa hit by strike during visit"
2024-03-01,Alexei Navalny's allies say a hearse with his body arrived at a Moscow church for the Kremlin foe's funeral
